{
  "schemaVersion": "1.0.0",
  "directory": "src/utils",
  "role": "Utility modules providing file sync, fingerprinting, CLI UI, and infrastructure support for ArchSpine.",
  "responsibility": "Combined, these utilities handle atomic file operations, git hook lifecycle management, file locking, SHA-256 fingerprinting of skeletons and semantics, agent instruction block synchronization, repository path normalization, interactive confirmation prompts, and branded CLI banner rendering.",
  "children": [
    {
      "filePath": "src/utils/agent-instructions.sync.ts",
      "role": "Centralized file I/O module for synchronizing and removing ArchSpine-managed configuration blocks in repository files (gitignore, gitattributes, agent instructions, search ignore, spine ignore, package.json scripts).",
      "fileKind": "source"
    },
    {
      "filePath": "src/utils/agent-instructions.templates.ts",
      "role": "Static configuration module providing agent instruction blocks and repository ignore patterns for the ArchSpine system.",
      "fileKind": "source"
    },
    {
      "filePath": "src/utils/agent-instructions.ts",
      "role": "TypeScript barrel export module providing a unified public API for agent instruction utilities.",
      "fileKind": "source"
    },
    {
      "filePath": "src/utils/banner.ts",
      "role": "CLI presentation utility for rendering branded banners and version information.",
      "fileKind": "source"
    },
    {
      "filePath": "src/utils/confirm.ts",
      "role": "Terminal input utility providing interactive confirmation prompts for CLI commands, supporting both explicit text input and immediate single-keypress modes.",
      "fileKind": "source"
    },
    {
      "filePath": "src/utils/footprint.ts",
      "role": "Utility module for generating deterministic SHA-256 fingerprints of architectural skeletons and semantic contracts.",
      "fileKind": "source"
    },
    {
      "filePath": "src/utils/fs.ts",
      "role": "Infrastructure utility class providing atomic file write and safe file copy operations for the ArchSpine system.",
      "fileKind": "source"
    },
    {
      "filePath": "src/utils/git-hook.ts",
      "role": "Infrastructure utility module for managing the ArchSpine pre-commit Git hook installation lifecycle.",
      "fileKind": "source"
    },
    {
      "filePath": "src/utils/lock.ts",
      "role": "Infrastructure utility providing file-based mutual exclusion for runtime operations across the ArchSpine system.",
      "fileKind": "source"
    },
    {
      "filePath": "src/utils/repo-path.ts",
      "role": "Internal utility function providing cross-platform repository path normalization for consistent database key representation.",
      "fileKind": "source"
    }
  ],
  "provenance": {
    "indexedAt": "2026-05-03T11:27:54.939Z",
    "generatorVersion": "archspine/1.0.0",
    "pipelineStages": [
      "ast",
      "llm"
    ]
  }
}