{
  "schemaVersion": "1.0.0",
  "directory": "examples/demo-project/.spine/index",
  "role": "Root configuration and structural index for the ArchSpine mirror system.",
  "responsibility": "Establishes the foundational metadata, indexing, and rule framework for the ArchSpine mirror system, enabling configuration management, semantic analysis, drift detection, dependency graph management, change intent recording, and rule engine organization.",
  "children": [
    {
      "filePath": "examples/demo-project/.spine/index/.spine",
      "role": "This directory serves as the root configuration and structural index for the ArchSpine mirror system, defining system identity, file tracking, and rule engine organization.",
      "fileKind": "folder"
    },
    {
      "filePath": "examples/demo-project/.spine/index/README.md.json",
      "role": "Metadata index entry for a documentation file (README.md) within the ArchSpine mirror system",
      "fileKind": "config"
    },
    {
      "filePath": "examples/demo-project/.spine/index/demo.gif.json",
      "role": "Metadata index entry for a binary/document file (demo.gif) within the ArchSpine mirror system",
      "fileKind": "config"
    },
    {
      "filePath": "examples/demo-project/.spine/index/project.json",
      "role": "Defines the structural layout and metadata of a project for the ArchSpine mirror system, mapping directory modules to their roles and responsibilities.",
      "fileKind": "config"
    },
    {
      "filePath": "examples/demo-project/.spine/index/src",
      "role": "Aggregates metadata and indexing records for the source code directory tree within the ArchSpine mirror system.",
      "fileKind": "folder"
    }
  ],
  "provenance": {
    "indexedAt": "2026-05-01T03:58:42.651Z",
    "generatorVersion": "archspine/1.0.0",
    "pipelineStages": [
      "ast",
      "llm"
    ]
  }
}