{
  "schemaVersion": "1.0.0",
  "directory": "src/assets",
  "role": "This directory contains the core template definitions and documentation standards for the ArchSpine mirror system.",
  "responsibility": "Collectively, these templates provide a standardized and extensible framework for documenting components, generating structured architecture summaries, enforcing architectural and coding standards, and analyzing the public surface and risk profile of the ArchSpine project, ensuring consistency and completeness across all architectural artifacts for both human readers and AI agents.",
  "children": [
    {
      "filePath": "src/assets/templates",
      "role": "This directory contains the core template definitions and documentation standards for the ArchSpine mirror system.",
      "fileKind": "folder"
    }
  ],
  "provenance": {
    "indexedAt": "2026-05-01T03:58:52.773Z",
    "generatorVersion": "archspine/1.0.0",
    "pipelineStages": [
      "ast",
      "llm"
    ]
  }
}