{
  "schemaVersion": "1.0.0",
  "directory": "examples/demo-project/.spine/atlas",
  "role": "This directory aggregates the core configuration and rule definitions that govern the ArchSpine mirror system's behavior and structure.",
  "responsibility": "Collectively, the components in this directory define system-level configuration parameters, establish structural guidelines for the .spine directory, enforce architectural rules and conventions for the mirror system, manage synchronization, indexing, validation, routing, and access control of mirrored data across distributed nodes, and define logical and functional layers including configuration management and interface abstraction to ensure consistency, fault tolerance, and a cohesive, extensible system architecture.",
  "children": [
    {
      "filePath": "examples/demo-project/.spine/atlas/English",
      "role": "This directory aggregates the core configuration and rule definitions that govern the ArchSpine mirror system's behavior and structure.",
      "fileKind": "folder"
    },
    {
      "filePath": "examples/demo-project/.spine/atlas/Simplified Chinese",
      "role": "This directory serves as the root configuration and structural definition hub for the ArchSpine mirror system.",
      "fileKind": "folder"
    },
    {
      "filePath": "examples/demo-project/.spine/atlas/en-US",
      "role": "This directory aggregates the second-level components of the ArchSpine mirror system, providing a consolidated view of subsystem interactions and data flow.",
      "fileKind": "folder"
    }
  ],
  "provenance": {
    "indexedAt": "2026-05-01T04:01:40.872Z",
    "generatorVersion": "archspine/1.0.0",
    "pipelineStages": [
      "ast",
      "llm"
    ]
  }
}