{
  "schemaVersion": "1.0.0",
  "directory": "examples/demo-project/.spine/atlas/Simplified Chinese",
  "role": "This directory serves as the root configuration and structural definition hub for the ArchSpine mirror system.",
  "responsibility": "It collectively defines foundational configuration, architectural rules, and structural roles for the .spine directory, provides demonstration assets and project overview documentation, and aggregates core source code layers including API, domain, and infrastructure components to deliver a complete application logic stack.",
  "children": [
    {
      "filePath": "examples/demo-project/.spine/atlas/Simplified Chinese/.spine",
      "role": "Root configuration and structural definition directory for the ArchSpine mirror system.",
      "fileKind": "folder"
    },
    {
      "filePath": "examples/demo-project/.spine/atlas/Simplified Chinese/demo.gif.md",
      "role": "Demonstration asset summary for the ArchSpine mirror system",
      "fileKind": "document"
    },
    {
      "filePath": "examples/demo-project/.spine/atlas/Simplified Chinese/project.md",
      "role": "Project overview and architecture demonstration document",
      "fileKind": "document"
    },
    {
      "filePath": "examples/demo-project/.spine/atlas/Simplified Chinese/src",
      "role": "This directory aggregates the core source code layers of the ArchSpine system, including API, domain, and infrastructure components.",
      "fileKind": "folder"
    }
  ],
  "provenance": {
    "indexedAt": "2026-05-01T03:58:38.637Z",
    "generatorVersion": "archspine/1.0.0",
    "pipelineStages": [
      "ast",
      "llm"
    ]
  }
}