{
  "schemaVersion": "1.0.0",
  "directory": "examples/github",
  "role": "This directory contains CI/CD workflow templates for automated architecture compliance checks using ArchSpine.",
  "responsibility": "Automates the execution of ArchSpine's sync and check commands on pull requests, provides architecture violation feedback via PR comments, and ensures architectural integrity is maintained before merging.",
  "children": [
    {
      "filePath": "examples/github/spine-check.yml",
      "role": "GitHub Actions workflow template for automated architecture compliance checks on pull requests",
      "fileKind": "document"
    }
  ],
  "provenance": {
    "indexedAt": "2026-05-12T05:22:00.379Z",
    "generatorVersion": "archspine/1.0.0",
    "pipelineStages": [
      "ast",
      "llm"
    ]
  }
}