{
  "schemaVersion": "1.0.0",
  "directory": "schemas",
  "role": "Defines the core schemas for metadata indexing, configuration, and governance of the ArchSpine mirror system.",
  "responsibility": "Provide a unified schema framework for defining folder units, manifests, project units, rules, and spine units, ensuring consistent validation, provenance tracking, and policy enforcement across the system.",
  "children": [
    {
      "filePath": "schemas/examples",
      "role": "This directory contains the core metadata, indexing configuration, and architectural governance rules for the ArchSpine mirror system.",
      "fileKind": "folder"
    },
    {
      "filePath": "schemas/shared.schema.json",
      "role": "Defines shared data type definitions used across all ArchSpine schemas to ensure type consistency and validation.",
      "fileKind": "config"
    },
    {
      "filePath": "schemas/spine-folder-unit.schema.json",
      "role": "Defines the schema for a folder unit within the ArchSpine documentation index, used to record the role, responsibility, and children file entries of a directory in the project.",
      "fileKind": "config"
    },
    {
      "filePath": "schemas/spine-manifest.schema.json",
      "role": "Manifest schema for ArchSpine sync index, recording the state of indexed source files, their documentation mappings across locales, and synchronization metadata.",
      "fileKind": "config"
    },
    {
      "filePath": "schemas/spine-project-unit.schema.json",
      "role": "Defines the structure and required fields for documenting a project unit within the ArchSpine mirror system, ensuring consistent representation of project metadata, module decomposition, and generation provenance.",
      "fileKind": "config"
    },
    {
      "filePath": "schemas/spine-rules.schema.json",
      "role": "Defines the schema for ArchSpine rule documents, ensuring consistency and enforceability of architectural and coding rules.",
      "fileKind": "config"
    },
    {
      "filePath": "schemas/spine-unit.schema.json",
      "role": "Defines the structural schema for ArchSpine SpineUnit documents, ensuring consistency and validity of unit metadata across the system.",
      "fileKind": "config"
    }
  ],
  "provenance": {
    "indexedAt": "2026-05-03T11:28:38.162Z",
    "generatorVersion": "archspine/1.0.0",
    "pipelineStages": [
      "ast",
      "llm"
    ]
  }
}