{
  "schemaVersion": "1.0.0",
  "directory": "examples/demo-project/.spine/atlas/Simplified Chinese/src/domain",
  "role": "Core domain layer containing business logic and entity definitions.",
  "responsibility": "Houses domain logic and core entity definitions independent of external frameworks, defines foundational data structures and interfaces, and implements domain services for user management including user creation, identity retrieval, and in-memory persistence.",
  "children": [
    {
      "filePath": "examples/demo-project/.spine/atlas/Simplified Chinese/src/domain/folder.md",
      "role": "Domain logic and core entity definitions",
      "fileKind": "document"
    },
    {
      "filePath": "examples/demo-project/.spine/atlas/Simplified Chinese/src/domain/user-service.ts.md",
      "role": "Domain service specification for user management",
      "fileKind": "document"
    }
  ],
  "provenance": {
    "indexedAt": "2026-05-01T03:58:31.288Z",
    "generatorVersion": "archspine/1.0.0",
    "pipelineStages": [
      "ast",
      "llm"
    ]
  }
}