{
  "schemaVersion": "1.0.0",
  "directory": "examples/demo-project/.spine/index/src/infra",
  "role": "Metadata and indexing layer for the ArchSpine mirror system's database infrastructure.",
  "responsibility": "Provides structural metadata, content integrity tracking, and provenance records for database-related source files and directories within the ArchSpine mirror system.",
  "children": [
    {
      "filePath": "examples/demo-project/.spine/index/src/infra/database.ts.json",
      "role": "Metadata and structural index for a TypeScript database infrastructure source file",
      "fileKind": "config"
    },
    {
      "filePath": "examples/demo-project/.spine/index/src/infra/folder.json",
      "role": "Defines the structural metadata and indexing provenance for a source code directory within the ArchSpine mirror system.",
      "fileKind": "config"
    }
  ],
  "provenance": {
    "indexedAt": "2026-05-01T03:58:34.643Z",
    "generatorVersion": "archspine/1.0.0",
    "pipelineStages": [
      "ast",
      "llm"
    ]
  }
}