{
  "schemaVersion": "1.0.0",
  "directory": "examples/demo-project/src",
  "role": "This directory aggregates the application's core layers: API, domain, and infrastructure.",
  "responsibility": "The components in this directory collectively provide the HTTP API for user creation, define the User domain entity with in-memory storage, and supply a database connectivity stub, though the API layer directly manages database connections, violating layered architecture principles.",
  "children": [
    {
      "filePath": "examples/demo-project/src/api",
      "role": "This directory contains the HTTP API handler for user creation operations.",
      "fileKind": "folder"
    },
    {
      "filePath": "examples/demo-project/src/domain",
      "role": "This directory contains the domain service for the User entity.",
      "fileKind": "folder"
    },
    {
      "filePath": "examples/demo-project/src/infra",
      "role": "Infrastructure layer providing database connectivity stubs.",
      "fileKind": "folder"
    }
  ],
  "provenance": {
    "indexedAt": "2026-05-01T03:58:47.747Z",
    "generatorVersion": "archspine/1.0.0",
    "pipelineStages": [
      "ast",
      "llm"
    ]
  }
}