{
  "schemaVersion": "1.0.0",
  "directory": "examples/demo-project/.spine/atlas/English/src/domain",
  "role": "Domain layer containing core business logic and entities for the ArchSpine mirror system.",
  "responsibility": "Defines fundamental data structures, domain interfaces, and business rules independent of external frameworks, including user management services for identity creation and retrieval.",
  "children": [
    {
      "filePath": "examples/demo-project/.spine/atlas/English/src/domain/folder.md",
      "role": "Defines the core business logic and domain entities for the ArchSpine system",
      "fileKind": "document"
    },
    {
      "filePath": "examples/demo-project/.spine/atlas/English/src/domain/user-service.ts.md",
      "role": "Domain service specification for user management within the ArchSpine mirror system",
      "fileKind": "document"
    }
  ],
  "provenance": {
    "indexedAt": "2026-05-01T03:58:31.307Z",
    "generatorVersion": "archspine/1.0.0",
    "pipelineStages": [
      "ast",
      "llm"
    ]
  }
}