{
  "schemaVersion": "1.0.0",
  "directory": "tests/unit/services/view",
  "role": "Test suites for the view producer modules in the ArchSpine mirror system.",
  "responsibility": "These tests validate that agent briefing and project health views are correctly generated, handling edge cases, schema validation, and filesystem cleanup.",
  "children": [
    {
      "filePath": "tests/unit/services/view/agent-briefing-view.test.ts",
      "role": "Vitest test suite for the agent briefing view producer.",
      "fileKind": "source"
    },
    {
      "filePath": "tests/unit/services/view/project-health-view.test.ts",
      "role": "Test suite for the projectHealthProducer view producer.",
      "fileKind": "source"
    }
  ],
  "provenance": {
    "indexedAt": "2026-05-10T05:11:39.076Z",
    "generatorVersion": "archspine/1.0.0",
    "pipelineStages": [
      "ast",
      "llm"
    ]
  }
}