{
  "schemaVersion": "1.0.0",
  "directory": "examples/demo-project/.spine/atlas/English/.spine/rules",
  "role": "This directory defines the architectural rules and conventions for the ArchSpine mirror system.",
  "responsibility": "Establishes structural guidelines for the .spine directory and defines rule enforcement boundaries and conventions.",
  "children": [
    {
      "filePath": "examples/demo-project/.spine/atlas/English/.spine/rules/arch.yml.md",
      "role": "Defines the architectural rules and conventions for the ArchSpine mirror system.",
      "fileKind": "document"
    },
    {
      "filePath": "examples/demo-project/.spine/atlas/English/.spine/rules/folder.md",
      "role": "Mock Folder Summary for .spine/rules in English",
      "fileKind": "document"
    }
  ],
  "provenance": {
    "indexedAt": "2026-05-01T03:58:31.062Z",
    "generatorVersion": "archspine/1.0.0",
    "pipelineStages": [
      "ast",
      "llm"
    ]
  }
}