{
  "schemaVersion": "1.0.0",
  "directory": "examples/demo-project/.spine/atlas/en-US/src/infra",
  "role": "This directory aggregates the second-level components of the ArchSpine mirror system, providing a consolidated view of its core structural modules.",
  "responsibility": "The components in this directory collectively define the logical and functional layers of the ArchSpine mirror, including data synchronization, configuration management, and interface abstraction, ensuring a cohesive and extensible system architecture.",
  "children": [],
  "provenance": {
    "indexedAt": "2026-04-30T17:33:35.361Z",
    "generatorVersion": "archspine/1.0.0",
    "pipelineStages": [
      "ast",
      "llm"
    ]
  }
}