{
  "schemaVersion": "1.0.0",
  "directory": "tests/infra/llm",
  "role": "Test suite for the LLM retry utility's error classification function.",
  "responsibility": "Validates that the `isRetryableError` function correctly classifies various error types as retryable or non-retryable, ensuring robust error handling for LLM interactions.",
  "children": [
    {
      "filePath": "tests/infra/llm/retry.test.ts",
      "role": "Vitest unit test suite for the LLM retry utility's error classification function.",
      "fileKind": "source"
    }
  ],
  "provenance": {
    "indexedAt": "2026-05-01T03:58:47.491Z",
    "generatorVersion": "archspine/1.0.0",
    "pipelineStages": [
      "ast",
      "llm"
    ]
  }
}