{
  "schemaVersion": "1.0.0",
  "directory": "research/bench/tests",
  "role": "This directory aggregates the second-level components of the ArchSpine mirror system, providing a consolidated view of subsystem interactions.",
  "responsibility": "The components in this directory collectively manage the synchronization, indexing, and access control of mirrored data across distributed nodes, ensuring consistency and availability.",
  "children": [],
  "provenance": {
    "indexedAt": "2026-04-30T17:33:52.238Z",
    "generatorVersion": "archspine/1.0.0",
    "pipelineStages": [
      "ast",
      "llm"
    ]
  }
}