{
  "schemaVersion": "1.0.0",
  "directory": "tests/integration",
  "role": "This directory contains integration tests that validate the core modules, boundaries, CLI, platform configuration, schema compliance, and system-level behaviors of the ArchSpine mirror system.",
  "responsibility": "Collectively, these tests enforce architectural boundaries, CLI correctness, platform-specific configuration resolution, schema compliance, and end-to-end system integration, ensuring the ArchSpine system remains modular, secure, and robust across all major components.",
  "children": [
    {
      "filePath": "tests/integration/boundaries",
      "role": "Test suite enforcing architectural boundaries and module contracts within the ArchSpine system.",
      "fileKind": "folder"
    },
    {
      "filePath": "tests/integration/cli",
      "role": "This directory contains integration and unit test suites for the ArchSpine CLI commands.",
      "fileKind": "folder"
    },
    {
      "filePath": "tests/integration/platform",
      "role": "Provides platform-specific resolution of the global ArchSpine configuration directory.",
      "fileKind": "folder"
    },
    {
      "filePath": "tests/integration/schema",
      "role": "Directory for schema validation and compliance testing of ArchSpine spine unit files.",
      "fileKind": "folder"
    },
    {
      "filePath": "tests/integration/system",
      "role": "This directory aggregates all test suites for the ArchSpine mirror system, covering unit and integration tests for core utilities, CLI governance, error handling, footprint calculation, manifest persistence, distributed locking, security boundaries, semantic drift detection, and spine gate infrastructure.",
      "fileKind": "folder"
    }
  ],
  "provenance": {
    "indexedAt": "2026-05-10T05:13:30.292Z",
    "generatorVersion": "archspine/1.0.0",
    "pipelineStages": [
      "ast",
      "llm"
    ]
  }
}