{
  "schemaVersion": "1.0.0",
  "directory": "src/assets/templates/view",
  "role": "This directory contains the public API surface documentation and risk hotspot analysis for the ArchSpine mirror system.",
  "responsibility": "Collectively, these files provide a comprehensive overview of the system's external interface (CLI, MCP, modules) and internal risk hotspots, enabling developers to understand the public surface and prioritize maintenance efforts.",
  "children": [
    {
      "filePath": "src/assets/templates/view/public-surface.md",
      "role": "Documentation of the public API surface of ArchSpine, including CLI, MCP, and module entry points.",
      "fileKind": "document"
    },
    {
      "filePath": "src/assets/templates/view/risk-hotspots.md",
      "role": "Risk hotspot report documentation for the ArchSpine codebase, highlighting files with highest risk to aid prioritization.",
      "fileKind": "document"
    }
  ],
  "provenance": {
    "indexedAt": "2026-05-03T12:18:16.134Z",
    "generatorVersion": "archspine/1.0.0",
    "pipelineStages": [
      "ast",
      "llm"
    ]
  }
}