{
  "schemaVersion": "1.0.0",
  "directory": "tests/integration/cli",
  "role": "This directory contains integration and unit test suites for the ArchSpine CLI commands.",
  "responsibility": "Collectively, these tests validate the CLI commands' functionality, including sync, init, LLM UI output, publish preflight validation, built CLI execution, argument validation, and view command, ensuring end-to-end correctness and proper error handling.",
  "children": [
    {
      "filePath": "tests/integration/cli/cli.test.ts",
      "role": "E2E integration test suite for the CLI sync workflow and related operations, validating the full lifecycle including initialization, sync, check, fix, usage reporting, and LLM interaction with a custom mock client.",
      "fileKind": "source"
    },
    {
      "filePath": "tests/integration/cli/init-cli.test.ts",
      "role": "Test module for the CLI initialization command (init) using vitest and child_process to validate CLI behavior.",
      "fileKind": "source"
    },
    {
      "filePath": "tests/integration/cli/llm-command-ui.test.ts",
      "role": "Vitest integration test suite for the LLM command UI output formatting and status display",
      "fileKind": "source"
    },
    {
      "filePath": "tests/integration/cli/publish-preflight.test.ts",
      "role": "Vitest test suite for the publish-preflight pre-validation logic.",
      "fileKind": "source"
    },
    {
      "filePath": "tests/integration/cli/sync-cli-built.test.ts",
      "role": "Integration test suite for the built CLI sync command and related operations.",
      "fileKind": "source"
    },
    {
      "filePath": "tests/integration/cli/sync-command.test.ts",
      "role": "Vitest integration test suite for sync command CLI argument validation in repair mode",
      "fileKind": "source"
    },
    {
      "filePath": "tests/integration/cli/view-command.test.ts",
      "role": "Test suite for the ArchSpine view command.",
      "fileKind": "source"
    }
  ],
  "provenance": {
    "indexedAt": "2026-05-10T05:12:03.083Z",
    "generatorVersion": "archspine/1.0.0",
    "pipelineStages": [
      "ast",
      "llm"
    ]
  }
}