{
  "schemaVersion": "1.0.0",
  "directory": "examples/demo-project/.spine/atlas/en-US/.spine",
  "role": "This directory aggregates the second-level components of the ArchSpine mirror system, providing a consolidated view of subsystem interactions.",
  "responsibility": "The components in this directory collectively manage the synchronization, validation, and routing of data across mirrored nodes, ensuring consistency and fault tolerance in the ArchSpine architecture.",
  "children": [
    {
      "filePath": "examples/demo-project/.spine/atlas/en-US/.spine/rules",
      "role": "This directory aggregates the second-level components of the ArchSpine mirror system, providing a consolidated view of subsystem interactions.",
      "fileKind": "folder"
    }
  ],
  "provenance": {
    "indexedAt": "2026-04-30T17:33:38.508Z",
    "generatorVersion": "archspine/1.0.0",
    "pipelineStages": [
      "ast",
      "llm"
    ]
  }
}