{
  "schemaVersion": "1.0.0",
  "directory": "tests/integration/schema",
  "role": "Directory for schema validation and compliance testing of ArchSpine spine unit files.",
  "responsibility": "Ensures that all generated spine unit JSON files conform to the defined JSON schemas and that the SyncService integration produces correct output, using Vitest and Ajv for validation.",
  "children": [
    {
      "filePath": "tests/integration/schema/schema-compliance.test.ts",
      "role": "Vitest integration test suite that validates generated spine unit files against JSON Schema and verifies SyncService output correctness.",
      "fileKind": "source"
    }
  ],
  "provenance": {
    "indexedAt": "2026-05-10T05:12:07.977Z",
    "generatorVersion": "archspine/1.0.0",
    "pipelineStages": [
      "ast",
      "llm"
    ]
  }
}