{
  "schemaVersion": "1.0.0",
  "directory": "src/assets/templates/rules",
  "role": "Defines architecture and naming conventions for the ArchSpine project.",
  "responsibility": "Provides layered architecture rules and test file naming conventions to ensure code consistency and proper separation of concerns.",
  "children": [
    {
      "filePath": "src/assets/templates/rules/layered-architecture.yml",
      "role": "Document defining layered architecture constraints for the ArchSpine project.",
      "fileKind": "document"
    },
    {
      "filePath": "src/assets/templates/rules/naming-conventions.yml",
      "role": "Defines a specific naming convention rule for test files.",
      "fileKind": "document"
    }
  ],
  "provenance": {
    "indexedAt": "2026-05-12T05:21:15.606Z",
    "generatorVersion": "archspine/1.0.0",
    "pipelineStages": [
      "ast",
      "llm"
    ]
  }
}