{
  "schemaVersion": "1.0.0",
  "directory": "src/assets/templates/prompts",
  "role": "This directory provides the prompt engineering toolkit for ArchSpine, including templates, rendering blocks, examples, and schemas used to generate structured semantic summaries via LLM.",
  "responsibility": "It collectively defines the reusable components for constructing LLM prompts that produce consistent JSON summaries for source files, documents, configurations, folders, and projects within the ArchSpine mirror system.",
  "children": [
    {
      "filePath": "src/assets/templates/prompts/arch-diagram.ts",
      "role": "LLM prompt template for generating structured JSON architecture diagram specifications from project and folder summaries.",
      "fileKind": "source"
    },
    {
      "filePath": "src/assets/templates/prompts/blocks.ts",
      "role": "Pure utility functions for rendering structured text blocks, primarily used in LLM prompt construction within ArchSpine.",
      "fileKind": "source"
    },
    {
      "filePath": "src/assets/templates/prompts/examples.ts",
      "role": "Static content module providing few-shot examples for semantic role description generation.",
      "fileKind": "source"
    },
    {
      "filePath": "src/assets/templates/prompts/index.ts",
      "role": "Public API facade aggregating and re-exporting prompt template schemas, rendering blocks, and example data.",
      "fileKind": "source"
    },
    {
      "filePath": "src/assets/templates/prompts/schemas.ts",
      "role": "Schema definition module providing JSON templates for ArchSpine semantic summary units.",
      "fileKind": "source"
    }
  ],
  "provenance": {
    "indexedAt": "2026-05-03T12:18:21.426Z",
    "generatorVersion": "archspine/1.0.0",
    "pipelineStages": [
      "ast",
      "llm"
    ]
  }
}